{
  "$schema": "https://json-schema.org/draft/2020-12/schema",
  "$id": "https://rrxiv.com/schema/v0/claim.schema.json",
  "title": "Claim",
  "description": "A single falsifiable assertion extracted from a paper. The unit of structured knowledge in the rrxiv corpus. Claim graph edges (depends_on, supports, contradicts, extends) connect claims across papers.",
  "version": "0.2.0",
  "type": "object",
  "required": ["id", "statement", "claim_type", "evidence_type"],
  "properties": {
    "id": {
      "type": "string",
      "description": "Stable, globally unique claim ID. Once assigned, NEVER changes. Suggested format: <paper_id>:<local_label>.",
      "examples": ["01923f8e-5b2a-7c4d-9e1f-3a2b1c0d4e5f:queryability"]
    },
    "paper_id": {
      "type": "string",
      "description": "ID of the paper this claim originates in. Same paper may contain many claims."
    },
    "statement": {
      "type": "string",
      "minLength": 1,
      "description": "The claim itself, expressed as a single falsifiable assertion in natural language. Should be standalone-readable."
    },
    "claim_type": {
      "type": "string",
      "enum": ["empirical", "theoretical", "definitional", "methodological", "computational"],
      "description": "What kind of claim this is."
    },
    "evidence_type": {
      "type": "string",
      "enum": ["proof", "experiment", "simulation", "observation", "argument", "definition", "convention"],
      "description": "What kind of evidence supports the claim within the paper."
    },
    "scope": {
      "type": "object",
      "description": "Conditions under which the claim is asserted to hold.",
      "properties": {
        "models": { "type": "array", "items": { "type": "string" } },
        "datasets": { "type": "array", "items": { "type": "string" } },
        "regimes": { "type": "array", "items": { "type": "string" } },
        "assumptions": { "type": "array", "items": { "type": "string" } }
      },
      "additionalProperties": false
    },
    "confidence": {
      "type": ["object", "null"],
      "description": "Author's stated confidence in the claim. Optional but encouraged.",
      "properties": {
        "point": { "type": "number", "minimum": 0, "maximum": 1 },
        "lower": { "type": "number", "minimum": 0, "maximum": 1 },
        "upper": { "type": "number", "minimum": 0, "maximum": 1 },
        "rationale": { "type": "string" }
      },
      "additionalProperties": false
    },
    "depends_on": {
      "type": "array",
      "items": { "type": "string" },
      "description": "IDs of claims (in this or other papers) that this claim relies on. Forms the dependency edges of the claim graph."
    },
    "supports": {
      "type": "array",
      "items": { "type": "string" },
      "description": "IDs of claims that this claim is presented as evidence for."
    },
    "contradicts": {
      "type": "array",
      "items": { "type": "string" },
      "description": "IDs of claims this claim contradicts. Author asserts the contradiction; community may dispute."
    },
    "extends": {
      "type": "array",
      "items": { "type": "string" },
      "description": "IDs of claims this claim extends or generalises."
    },
    "replication_status": {
      "type": "string",
      "enum": ["untested", "partial", "replicated", "contradicted", "retracted"],
      "default": "untested",
      "description": "Aggregate replication status. Updated by server based on annotations."
    },
    "labels": {
      "type": "array",
      "items": { "type": "string" },
      "description": "Free-form labels (e.g. 'load-bearing', 'speculative', 'background')."
    },
    "proof": {
      "type": ["string", "null"],
      "description": "Plain-text proof or evidence body that accompanies this claim. Extracted from the paired `evidence` environment in the source (parser pairs `\\label{prop:X.Y}` to `\\label{ev:X.Y}`). Multi-paragraph; preserves `$...$` math markers verbatim so renderers can hand off to KaTeX or MathJax. `\\dependson` lines are stripped (the edge information already lives in `depends_on`). Optional; CIRs without a paired evidence block omit this field. See RRP-0015."
    },
    "figures": {
      "type": "array",
      "description": "Figures referenced inside the proof body via `\\input{figures/...}`. Each entry records the source-relative path to the figure file and optionally its caption. Paths are relative to the paper's source-archive root (the tarball at `source.uri`). Optional; populated by the parser when the evidence block contains figure inputs. See RRP-0015.",
      "items": { "$ref": "#/$defs/ClaimFigure" }
    },
    "source_location": {
      "type": ["object", "null"],
      "description": "Where in the source the claim originates, for provenance. Combines the prior section-level provenance fields with file/line span coordinates for the `\\begin{claim}...\\end{claim}` block plus the immediately-following `\\begin{evidence}...\\end{evidence}` block. Lines are 1-indexed. In multi-file papers, `file` is the source-archive-relative path resolved via the flatten-tex marker comments (`% [flatten-tex.py] inlined: <path>` / `% [flatten-tex.py] end: <path>`); single-file papers report the source filename. See RRP-0015.",
      "properties": {
        "section_id": { "type": "string" },
        "paragraph": { "type": ["integer", "null"], "minimum": 0 },
        "raw_source_excerpt": { "type": ["string", "null"] },
        "file": {
          "type": ["string", "null"],
          "description": "Source-archive-relative path to the file containing the claim, e.g. `books/book01.tex`."
        },
        "line_start": {
          "type": ["integer", "null"],
          "minimum": 1,
          "description": "1-indexed line number of the `\\begin{claim}` in `file`."
        },
        "line_end": {
          "type": ["integer", "null"],
          "minimum": 1,
          "description": "1-indexed line number of the `\\end{evidence}` (or `\\end{claim}` when no evidence block follows) in `file`."
        }
      },
      "additionalProperties": false
    },
    "pdf_anchor": {
      "type": ["string", "null"],
      "description": "URL fragment that pins the rendered PDF to the page (or named destination) where the claim appears. Typically `#page=N` for raw page anchors, or `#nameddest=<id>` when the PDF carries named destinations. Optional; the parser leaves this null because computing the page number requires the rendered PDF cross-reference table (operators or downstream pipelines populate it). Specified here so future generators have a stable place to put it. See RRP-0015."
    },
    "extracted_by": {
      "type": "string",
      "enum": ["author", "agent", "annotator"],
      "description": "Who extracted this claim. Author-extracted claims are canonical from submission; others require confirmation."
    },
    "canonical": {
      "type": "boolean",
      "default": false,
      "description": "True if confirmed by paper author or via quorum of credentialed annotators."
    }
  },
  "$defs": {
    "ClaimFigure": {
      "type": "object",
      "required": ["path"],
      "properties": {
        "path": {
          "type": "string",
          "minLength": 1,
          "description": "Source-archive-relative path to the figure file (e.g. `figures/fig-i-10.tex`). The figure is bundled in the paper's `source.tar.gz` and resolved relative to its root."
        },
        "caption": {
          "type": ["string", "null"],
          "description": "Plain-text figure caption. Optional; the parser populates it when the figure file contains a `\\caption{...}` macro."
        }
      },
      "additionalProperties": false
    }
  },
  "examples": [
    {
      "id": "01923f8e-5b2a-7c4d-9e1f-3a2b1c0d4e5f:queryability",
      "paper_id": "01923f8e-5b2a-7c4d-9e1f-3a2b1c0d4e5f",
      "statement": "A protocol that exposes claims as first-class structured entities is queryable by agents in ways an unstructured PDF corpus is not.",
      "claim_type": "theoretical",
      "evidence_type": "argument",
      "depends_on": ["01923f8e-5b2a-7c4d-9e1f-3a2b1c0d4e5f:volume-structure"],
      "labels": ["load-bearing"],
      "extracted_by": "author",
      "canonical": true
    },
    {
      "id": "01923f8e-0009-7c4d-9e1f-3a2b1c0d4e5f:prop:I.1",
      "paper_id": "01923f8e-0009-7c4d-9e1f-3a2b1c0d4e5f",
      "statement": "On a given finite straight line to construct an equilateral triangle.",
      "claim_type": "theoretical",
      "evidence_type": "proof",
      "proof": "Let $AB$ be the given finite straight line. With centre $A$ and distance $AB$ describe the circle $BCD$ (Postulate 3). With centre $B$ and distance $BA$ describe the circle $ACE$ (Postulate 3). From the point $C$, where the circles cut one another, draw $CA$ and $CB$ (Postulate 1). Since $A$ is the centre of $BCD$, $AC = AB$ (Definition I.15). Since $B$ is the centre of $ACE$, $BC = BA$ (Definition I.15). By Common Notion 1, $AC = BC$. Therefore the triangle $ABC$ is equilateral.",
      "figures": [
        {
          "path": "figures/fig-i-1.tex",
          "caption": "Proposition I.1. The two circles with centres $A$ and $B$ and common radius $AB$ meet at $C$; the triangle $ABC$ is equilateral."
        }
      ],
      "source_location": {
        "file": "books/book01.tex",
        "line_start": 13,
        "line_end": 31
      },
      "pdf_anchor": "#page=12",
      "extracted_by": "author",
      "canonical": true
    }
  ]
}
